{"id":"COMPAT-CAD-009","title":"Blocks, inserts, attributes and symbols","issue":13,"architecture_version":"1.1","requirements":["CAD-001"],"dependencies":["COMPAT-CAD-008"],"objective":"Implement the next bounded AutoCAD-class capability for blocks, inserts, attributes and symbols with canonical ownership, identity, rendering/selectability, deterministic serialization, undo/redo and Web/Electron parity while preserving frozen Architecture v1.1.","acceptance_criteria":["Block definitions have deterministic canonical identity and explicit ownership/provenance.","Block inserts/materialized instances have deterministic canonical identity, ordering and source-definition linkage without creating a competing application authority.","Attributes are explicitly owned by the appropriate block definition/insert semantics and remain canonical, deterministic and selectable/renderable where required.","Symbol semantics required by the roadmap are explicit, deterministic and bounded to this work item.","Creation and supported edits form the required atomic canonical revision and integrate with existing undo/redo without phantom or orphaned entities.","Deletion of definitions, inserts and owned attributes follows a deterministic policy and cannot leave hidden canonical or orphaned entities.","Invalid and unsupported cases fail with the existing typed error taxonomy before mutation.","Web and Electron execute the same engine-free semantic command path and converge on equivalent affected serialized state.","Required roadmap browser workflows exercise block/insert/attribute/symbol creation, visibility and selection through the real UI, including negative/unsupported cases.","COMPAT-CAD-005 through COMPAT-CAD-008 verified behavior remains regression-green.","Architecture v1.1, Construction Graph authority and engine/adapter boundaries remain unchanged unless an approved ACR is required."],"non_goals":["No hatch/annotation/dimension/inspection expansion; COMPAT-CAD-010 owns that work.","No durable SAVE/OPEN or multi-instance persistence; COMPAT-CAD-011/infrastructure owns that work.","No DXF import/export; COMPAT-CAD-012 owns that work.","No layouts/sheets/viewports/plot; COMPAT-CAD-013 owns that work.","No broad command-language/options/help expansion; COMPAT-CAD-014 owns that work.","No generalized undo/history/long-session expansion; COMPAT-CAD-015 owns that work.","No architecture change without an approved ACR.","No benchmark score increase claim without a measured full-corpus rerun."],"risk_assumptions":["COMPAT-CAD-008 is VERIFIED at physical product merge 3854f539 and is the immediate predecessor baseline.","Existing engine-free shared geometry and canonical revision semantics are sufficient for the bounded block capability; any native engine dependency must remain behind EngineAdapterBundle.","Definition/insert/attribute previews remain presentation state until canonical commit.","Ownership/provenance must remain domain-owned and deterministic.","Historical governance defects remain isolated from implementation validity."],"evidence_requirements":["Deterministic automated tests for definitions, inserts, attributes, symbols, invalid and unsupported cases.","Deterministic identity/provenance/order and byte-serialization fixtures.","Web/Electron parity evidence over the affected semantic command stream.","Regression evidence for COMPAT-CAD-005, 006, 007 and 008.","Exact-head CI evidence.","Exact-head deployment and independent browser-agent evidence for the assigned Golden workflows.","Revision-bound governance evidence sufficient for independent Architect verification."],"state":"IMPLEMENTING","transitions":[{"from":"DRAFT","to":"READY","at":"2026-09-06T07:09:20Z","actor":"payswapdotorg","role":"architect","reason":"COMPAT-CAD-008 is VERIFIED and the dependency-ordered CC009 scope is frozen.","references":{"issue":13}},{"from":"READY","to":"ASSIGNED","at":"2026-09-06T07:09:30Z","actor":"payswapdotorg","role":"architect","reason":"Authorize z-ai-implementation-agent for the frozen CC009 scope with stop gate PR_OPEN/VERIFYING.","references":{"issue":13,"assignee":"z-ai-implementation-agent","artifact":"docs/work-items/COMPAT-CAD-009-ZAI-PROMPT.md"}},{"from":"ASSIGNED","to":"IMPLEMENTING","at":"2026-09-06T07:15:00Z","actor":"z-ai-implementation-agent","role":"implementer","reason":"Begin the frozen CC009 blocks/inserts/attributes/symbols scope on payswapdotorg/offisos from the verified mainline. Implement deterministic INSERT provenance/ownership analogous to CC008 and the 12-fixture deterministic suite.","references":{"issue":13,"commit":"46d8cafd1ac4b1dd50e5b1a4d566dae10661095e"}},{"from":"IMPLEMENTING","to":"PR_OPEN","at":"2026-09-06T07:22:00Z","actor":"z-ai-implementation-agent","role":"implementer","reason":"CC009 implementation complete at the implementation head; PR #14 open against main carrying the InsertProvenance additive type, insertsOfBlockDef helper and the 12-fixture deterministic suite.","references":{"pr":14,"commit":"46d8cafd1ac4b1dd50e5b1a4d566dae10661095e"}},{"from":"PR_OPEN","to":"VERIFYING","at":"2026-09-06T07:23:00Z","actor":"z-ai-implementation-agent","role":"implementer","reason":"Submit COMPAT-CAD-009 for independent Architect verification. Revision-bound implementer evidence recorded; exact-head CI, deployment and independent browser-agent evidence are Architect-owned gates.","references":{"pr":14,"evidence":["EV-001","EV-002"]}},{"from":"VERIFYING","to":"ARCHITECT_REVIEW","at":"2026-09-06T09:20:00Z","actor":"payswapdotorg","role":"architect","reason":"Independent Architect review identified revision-binding drift plus material CC009 acceptance gaps: INSERT provenance index reuse after deletion is possible; insertProvenance.blockId is not validated against the canonical blockId; and the mandatory independent exact-deployment browser gate for G5/G7/G8 is not supplied. These must be closed before approval.","references":{"pr":14,"commit":"46d8cafd1ac4b1dd50e5b1a4d566dae10661095e","evidence":["EV-001","EV-002","EV-003"]}},{"from":"ARCHITECT_REVIEW","to":"IMPLEMENTING","at":"2026-09-06T09:21:00Z","actor":"payswapdotorg","role":"architect","reason":"Return CC009 for bounded remediation. Preserve the existing implementation where sound, but make provenance ownership internally consistent and monotonic, add deterministic regression tests for deletion/reinsert and malformed provenance, and provide the required exact-head independent browser-agent evidence for G5/G7/G8 before the next return.","failure_reason":"CC009 is not verification-complete. The implementation can generate duplicate insertIndex values after deletions, permits provenance blockId to disagree with the canonical blockRef blockId, and lacks the required independent browser-agent verification of the assigned roadmap workflows. The current PR/record also had stale revision bindings before reconciliation.","references":{"pr":14,"decision":"DEC-001"}}],"evidence":[{"id":"EV-001","type":"automated-test-suite","description":"Full deterministic app suite at implementation head 46d8cafd: 1502 tests, 1446 pass, 0 fail, 56 OCCT/IFC-gated skip. Includes the 12 CC009 block fixtures B1-B12 and engine-boundary checks.","produced_at":"2026-09-06T09:15:00Z","reproducible":true,"references":{"commit":"46d8cafd1ac4b1dd50e5b1a4d566dae10661095e","path":"app/test/compat-cad-009.test.ts"}},{"id":"EV-002","type":"reproducible-script","description":"Governance validation at implementation head 46d8cafd: 600/600 validation, governance deterministic suite 200/200, protected-path audit pass, verified-revision audit pass, root/app typechecks pass.","produced_at":"2026-09-06T09:16:00Z","reproducible":true,"references":{"commit":"46d8cafd1ac4b1dd50e5b1a4d566dae10661095e","pr":14}},{"id":"EV-003","type":"ci-run","description":"Exact-head CI for CC009 implementation revision 46d8cafd completed successfully across the workspace deterministic suite, Electron host and Web host. Electron passed the CAD-PARITY-006 blocks smoke; Web passed the complete workspace/parity suite and governance passed at the same revision.","produced_at":"2026-09-06T09:17:30Z","reproducible":true,"reproduction":"GitHub Actions cad-parity-018 run 34020852445 at exact head 46d8cafd1ac4b1dd50e5b1a4d566dae10661095e; governance run 34020852423 also passed at the exact head.","references":{"workflow_run":"34020852445","commit":"46d8cafd1ac4b1dd50e5b1a4d566dae10661095e"}},{"id":"DEC-001","type":"inspectable-artifact","description":"Architect decision record for returning CC009 to IMPLEMENTING after independent review found provenance monotonicity/consistency and mandatory browser-gate evidence gaps.","produced_at":"2026-09-06T09:21:00Z","reproducible":true,"references":{"pr":14,"commit":"fa34e85ffc84ee5d6bde93bf4b604675afd66d46"}}],"decisions":[{"id":"DEC-001","status":"changes_requested","decided_at":"2026-09-06T09:21:00Z","decided_by":"payswapdotorg","role":"architect","rationale":"CC009 requires bounded remediation before approval: monotonic/consistent insert provenance and the mandatory independent browser-agent gate for G5/G7/G8 must be supplied. The frozen Architecture v1.1 boundary remains unchanged.","evidence_refs":["EV-001","EV-002","EV-003"],"remediation_required":"Ensure insertIndex is globally monotonic or otherwise collision-free within a definition across deletion/reinsert history; reject provenance whose blockId disagrees with the canonical blockRef blockId; add deterministic tests for those cases and return with exact-head CI plus exact deployment/browser evidence covering G5, G7 and G8, including negative/unsupported behavior and selection/visibility."}]}