{
  "id":"COMPAT-CAD-007","title":"Core editing and deterministic object-selection workflows","issue":1,"architecture_version":"1.1","requirements":["CAD-001"],"dependencies":["COMPAT-CAD-006"],"objective":"Restore the next bounded CAD editing layer: deterministic object-selection and core modify workflows over the verified shared geometry, precision and viewport foundations, without changing ConstructionOS Architecture v1.1 or canonical authority.","acceptance_criteria":["Representative G1/G2/G4/G10 selection/edit workflows complete through the real UI with deterministic evidence.","Selection, picking and Properties/status surfaces agree on one canonical live selection.","Supported edits produce exact deterministic canonical geometry and one revision per mutating command under the existing command model.","Undo/redo restores exact prior state without phantom or stale selection.","Invalid and unsupported edit cases fail explicitly and never fabricate geometry or success.","Web/Electron execute the same semantic command paths and converge on equivalent affected serialized state.","COMPAT-CAD-005 and COMPAT-CAD-006 verified behavior remains regression-green, including layer identity, canonical selection, picking, navigation, and no-mutation guarantees.","No frozen Architecture v1.1 boundary, Construction Graph authority, or engine/adapter boundary is modified without an ACR."],"non_goals":["No ARRAY materialization/render/selectability; COMPAT-CAD-008 owns DEF-015.","No durable SAVE/OPEN or serverless multi-instance session persistence; COMPAT-CAD-011 / infrastructure track.","No DXF; COMPAT-CAD-012.","No layout/sheet viewport identity; COMPAT-CAD-013.","No unrelated BIM, documentation or interoperability expansion.","No architecture modification without an ACR.","No full AutoCAD parity claim and no benchmark score change without a benchmark rerun."],"risk_assumptions":["COMPAT-CAD-006 is the required verified viewport/transform baseline and its shared transform module remains the canonical screen/world conversion path.","The existing engine-free shared geometry/precision core is sufficient for the bounded selection/edit slice; unsupported cases remain typed rather than approximated.","Interactive previews and transient selection remain presentation state until canonical commit.","The known main-side CAD-PARITY-020 governance defect may keep root governance red; it is Architect-owned and must not be modified by this work item.","ARRAY, durable persistence, DXF and layout identity remain independent successor concerns even where this phase makes their prerequisite selection/edit flows usable."],"evidence_requirements":["Deterministic automated selection/edit tests including invalid and unsupported cases.","Negative tests proving previews/transient selection do not mutate canonical state before commit and failures do not emit false success.","Web/Electron parity evidence over the affected semantic stream.","Regression evidence for COMPAT-CAD-005 and COMPAT-CAD-006.","Exact-head CI evidence with pre-existing main-side failures isolated honestly.","Exact-head deployment and independent browser-agent evidence.","Real browser Golden G1, G2, G4 and G10 execution plus targeted DEF-006/007/021 probes.","Revision-bound evidence recorded in this governance record before Architect review."],"state":"VERIFYING","transitions":[{"from":"DRAFT","to":"READY","at":"2026-09-05T06:40:00Z","actor":"pectoraux","role":"architect","reason":"COMPAT-CAD-006 is VERIFIED at merge eb340634; the dependency-ordered Phase 3 CAD editing slice is bounded by the authoritative roadmap and Issue #1.","references":{"issue":1}},{"from":"READY","to":"ASSIGNED","at":"2026-09-05T06:41:00Z","actor":"pectoraux","role":"architect","reason":"Authorize z-ai-implementation-agent to implement the frozen COMPAT-CAD-007 scope and stop at PR_OPEN/VERIFYING; directive: docs/work-items/COMPAT-CAD-007-ZAI-PROMPT.md.","references":{"issue":1,"assignee":"z-ai-implementation-agent"}},{"from":"ASSIGNED","to":"IMPLEMENTING","at":"2026-09-05T14:08:35Z","actor":"z-ai-implementation-agent","role":"implementer","reason":"Begin the frozen CC007 scope on payswapdotorg/offisos from fork main b8c2210 (the lawful ASSIGNED handoff head, containing the CC006 VERIFIED merge eb340634 and the INFRA-002 release): the shared deterministic selection layer (the entity-step keyword vocabulary ALL/LAST/L/P/PREVIOUS over the shared pickable view + the window/crossing entities batch into command select phases — DEF-021/DEF-006), the prompt-owns-input contract (advertised option word-forms honored; typed tokens never cancel a running command — DEF-007), the G4 trim closure fix (implied-all edges cut mutually), and the ERASE canonical-partition fix discovered by the G10 flow; directive: docs/work-items/COMPAT-CAD-007-ZAI-PROMPT.md.","references":{"issue":1,"commit":"9b7a2ef"}},{"from":"IMPLEMENTING","to":"PR_OPEN","at":"2026-09-05T14:21:47Z","actor":"z-ai-implementation-agent","role":"implementer","reason":"Selection/edit implementation complete at the PR implementation head: the DEF-021/006/007 remediation, the G4 trim-closure and ERASE-partition fixes, the composed multi-pick TRIM fix (the third in-scope defect, discovered by the exact-head browser G4 gate), 33 deterministic app-suite tests (incl. negative no-mutation/false-success, the composed-trim regression, Web/Electron host parity, CC005/CC006 regression pins), real-host web + electron smokes and the local gate battery all green; PR #3 opened against fork main.","references":{"pr":3,"commit":"521ee3ee4b1d64e934a03602af136254b8656183","issue":1}},{"from":"PR_OPEN","to":"VERIFYING","at":"2026-09-05T14:21:47Z","actor":"z-ai-implementation-agent","role":"implementer","reason":"Submit COMPAT-CAD-007 for independent Architect verification; EV-001/EV-002 recorded at the final implementation head. Exact-head CI, exact-head deployment and independent browser-agent Golden G1/G2/G4/G10 + DEF-006/007/021 probe evidence follow as PR comments at the exact head.","references":{"pr":3,"evidence":["EV-001","EV-002"]}}],"evidence":[{"id":"EV-001","type":"automated-test-suite","description":"Full deterministic app suite at the final implementation head: 1459 tests, 1403 pass, 0 fail, 56 OCCT-gated skips (the CC006 baseline 1426/1370/56 + the 33 new COMPAT-CAD-007 tests: DEF-007 option word-forms and no-escape pins, DEF-021 selection-keyword semantics incl. legacy-context typed declines, DEF-006 window/crossing batch semantics incl. dedupe/filter/single-step declines, the G4 quadrilateral trim closure with exact geometry and one atomic revision, the composed multi-pick TRIM regression (nine picks incl. the honest stale re-pick: union-of-picked-pieces, the exact closed square, one atomic revision), the WebHost/ElectronHost byte-identical composed-trim parity pin, the G10 ERASE-ALL/UNDO exact restore, negative no-plan/no-mutation guarantees, determinism byte-identity, WebHost/WebSocketTransport + ElectronHost/IpcTransport parity with equivalent final serialized state, CC005/CC006 regression pins). app/web/electron typechecks and builds clean.","produced_at":"2026-09-05T14:45:56Z","reproducible":true,"reproduction":"cd app && npm test; cd app && npm run typecheck; cd apps/web && npm run lint && npx tsc --noEmit && npm run build; cd apps/electron && npm run typecheck && npm run build","references":{"commit":"521ee3ee4b1d64e934a03602af136254b8656183","path":"app/test/compat-cad-007.test.ts","pr":3}},{"id":"EV-002","type":"reproducible-script","description":"Real-host selection/edit stream evidence: the web compat-cad-007 smoke (DEF-021 MOVE+ALL one revision, the DEF-006 window batch ERASE, LAST+UNDO byte-identical restore, the DEF-007 engine stream, the single-pick G4 closure AND the composed eight-pick G4 closure with the honest stale re-pick through the REAL server, the negative failed-edit probe) plus the compat-cad-005/006 regression smokes on a fresh dev server (OFFISOS_P016_PERSIST=memory, the documented local-dev opt-in), and the Electron real-UI smoke:cad007 18/18 PASS plus smoke:cad006 and smoke:workspace regressions (the workspace save sha matches the Web host parity fixture).","produced_at":"2026-09-05T14:45:56Z","reproducible":true,"reproduction":"cd apps/web && npm run dev -- --webpack -p 3100 & node --import tsx apps/web/test/compat-cad-007-smoke.mjs; node --import tsx apps/web/test/compat-cad-006-smoke.mjs; (fresh server) node --import tsx apps/web/test/compat-cad-005-smoke.mjs; cd apps/electron && npm run smoke:cad007 && npm run smoke:cad006 && npm run smoke:workspace","references":{"commit":"521ee3ee4b1d64e934a03602af136254b8656183","path":"apps/web/test/compat-cad-007-smoke.mjs","pr":3}}],"decisions":[]
}
