{"id":"CAD-PARITY-017","title":"Automation, extension and API surface","issue":116,"architecture_version":"1.1","requirements":["API-001"],"dependencies":["CAD-PARITY-016"],"objective":"Extend the verified CAD/BIM product with a bounded, deterministic automation and extension/API surface for scripting, integrations and controlled third-party extensions while preserving ConstructionOS Architecture v1.1, Construction Graph authority, existing CAD/BIM semantics and Web/Electron parity.","acceptance_criteria":["Automation requests use versioned typed contracts and deterministic command/query semantics.","Automation cannot mutate canonical state except through the existing governed App API/domain transaction path.","Extension code cannot import or bypass protected engine/renderer/domain boundaries.","Unsupported capabilities return explicit typed failures; no fabricated semantics.","Script/workflow execution is reproducible for identical canonical inputs and declared environment/profile.","Canonical revision/event identity remains authoritative and revision-bound in automation results.","Event/subscription delivery is bounded, ordered and explicitly scoped; no hidden background authority is introduced.","Web and Electron expose identical semantic automation/extension behavior.","Existing CAD-PARITY-002..016 and compatibility baselines remain green and byte-identical unless an explicitly reviewed migration is required.","Exact final head is CI-verified, deployment/browser/Electron verified where applicable, and revision-bound before merge.","No protected architecture paths are modified; architecture changes require an ACR."],"non_goals":["Unbounded plugin ecosystems or arbitrary native-code execution.","Replacing the App API, Construction Graph, CADDocument, renderer or engine-adapter boundaries.","Cloud-scale orchestration beyond the bounded durable job mechanism already established in P016.","Autonomous agents with unrestricted write access.","Proprietary vendor API compatibility unless separately scoped and approved.","Architecture changes without an ACR."],"risk_assumptions":["CAD-PARITY-016 is VERIFIED and is the required predecessor baseline before P017 implementation.","Construction Graph remains authoritative and CADDocument remains the editor representation.","Architecture v1.1 remains frozen throughout P017.","Existing engine, worker, persistence and durable-job boundaries remain available and authoritative as defined by prior verified work."],"evidence_requirements":["Contract/schema and capability-discovery tests.","Deterministic automation/script fixtures with replay/reproducibility assertions.","Authorization and boundary tests proving automation cannot bypass canonical mutation paths.","Event ordering/subscription and durable-job integration tests where applicable.","Web/Electron semantic parity fixtures.","Regression proof that CAD-PARITY-002..016 and compatibility baselines remain green and byte-identical.","Exact-head deployment plus real-browser/Electron evidence where applicable.","Revision-bound governance evidence covering implementation, merge and post-merge verification."],"state":"IMPLEMENTING","transitions":[{"from":"DRAFT","to":"READY","at":"2026-09-02T12:45:02Z","actor":"pectoraux","role":"architect","reason":"Dependency CAD-PARITY-016 is formally VERIFIED against mainline merge revision c06df768365c706cae3483fc927d25bfdee63a80; release P017 from dependency lock under frozen Architecture v1.1.","references":{"issue":116}},{"from":"READY","to":"ASSIGNED","at":"2026-09-02T12:45:03Z","actor":"pectoraux","role":"architect","reason":"Authorize CAD-PARITY-017 implementation to the logical implementation agent. Implementation must stop at PR_OPEN/VERIFYING for Architect review; merge, approval and verification remain Architect-owned gates.","references":{"issue":116,"assignee":"z-ai-implementation-agent"}},{"from":"ASSIGNED","to":"IMPLEMENTING","at":"2026-09-02T13:17:00Z","actor":"z-ai-implementation-agent","role":"implementer","reason":"Implementation begins for CAD-PARITY-017 from the verified CAD-PARITY-016 mainline baseline (merge c06df768365c706cae3483fc927d25bfdee63a80, baseline db94043). Scope is the bounded automation, extension and API surface slice defined by Issue #116 — versioned typed automation contracts over the governed App API, deterministic script/workflow execution with reproducible fixtures, capability discovery with typed unsupported-operation results, manifest-based extensions that cannot bypass protected boundaries, a bounded ordered scoped event/subscription surface derived from canonical revision records, authorization hooks reusing the existing role/ability model, and bounded durable-job integration — preserving Construction Graph authority, frozen Architecture v1.1, the byte-identical CAD-PARITY-002..016 and compatibility baselines, and the PR_OPEN/VERIFYING stop gate.","references":{"issue":116,"commit":"db94043ce905a5813b250458376bf9fe2c3c86aa"}}],"evidence":[],"decisions":[]}